"RIVERSOFT","Klima DIPLOMAT DAC-180CA Inverter -20 , A++, R32","32999.00 ден.","https://digimak.s3.eu-west-1.amazonaws.com/riversoft/9992939/1.webp","Тип: Инвертор;","Управување:Далечински;","Моќност во режим на ладење: 5100W;","Моќност во режим на греење: 5130W;","6 степени на брзина на вентилаторот;","Автоматско рестартирање;","Паметен проток на воздух;","Лесен за чистење филтер;","Интелигентно одмрзнување;","Самодијагностика","Тајмер;","Турбо режим","Режим на спиење;","Самочистење;","Филтер за прашина;","Заштита на децата;","Био филтер;","Лед дисплеј","SEER: 6.1;","Енергетска класа: A++;","SCOP медиум: 4.0;","Проток на воздух: 820 m3/h","Греење -20","Ладење 53","Греач на надворешна единица","Бучност на внатрешна единица: 54dB","Бучност на надворешна единица: 63dB","Отстранување на влага: 1,5L/час;","Напон: 220-240V/50Hz;","Напојување: надворешен;","Потрошувачка на енергија во режим на ладење: 1574W;","Потрошувачка на енергија во режим на греење: 1382W;","Разладно средство: R32;","Димензии на внатрешната единица (WxHxD): 920x306x195mm;","Димензии на надворешниот уред (WxHxD): 853x602x349mm;","Нето тежина на внатрешната единица: 11кг;","Нето тежина на надворешната единица: 35кг;","Големина на пакетот на внатрешната единица: 990x380x265mm;","Големина на пакетот на надворешниот уред: 890x628x385mm;","Бруто тежина на внатрешната единица: 13кг;","Бруто тежина на надворешниот уред (без цевки): 38кг;","","","","","","","","","","","","","","","","","","","","","","","","","","","","","","","","","","","","","","","","","","","","","","","","","","","","","","","","","","","","","","","","","","","","","","","","","",""
"RIVERSOFT","Klima HOOBART HBAX18INV-WMSE2 18-ka Inverter -25 A++/A+","32999.00 ден.","https://digimak.s3.eu-west-1.amazonaws.com/riversoft/47014133/1.webp","Инвертер клима уред","Моќност: 5.3kW","Моќност ладење/греење: 5300/5400W","Енергетска класа на ладење: A++","Енергетска класа на греење: A+","Циркулација на воздух: до 950m?/h","Работна температура: ладење:-15 - 49/греење:-25 - 32°C","SEER: 6.8","SCOP: 4","Ниво на бучава (Внатрешна единица): 58dB","Годишна потрошувачка на енергија за греење: 1365kWh/a","Годишн","","","","","","","","","","","","","","","","","","","","","","","","","","","","","","","","","","","","","","","","","","","","","","","","","","","","","","","","","","","","","","","","","","","","","","","","","","","","","","","","","","","","","","","","","","","","","","","","","","","","","","",""
"RIVERSOFT","Klima VOX IVA8-12JRBW Wi-Fi Black, Inverter 12ka 3.5KW, A++/A+, LCD Display, Fil","33900.00 ден.","https://digimak.s3.eu-west-1.amazonaws.com/riversoft/15964/1.webp","ЕНЕРГЕТСКА КЛАСА A++/A+","BTU 12000","КАПАЦИТЕТ ЗА ЛАДЕЊЕ, KW 3,5","КАПАЦИТЕТ ЗА ГРЕЕЊЕ, KW 3.8","НОМИНАЛНА ПОТРОШУВАЧКА ПРИ ЛАДЕЊЕ, KW 1.1","НОМИНАЛНА ПОТРОШУВАЧКА ПРИ ГРЕЕЊЕ, KW 1.18","ГОДИШНА ПОТРОШУВАЧКА ПРИ ЛАДЕЊЕ, KW 198","ГОДИШНА ПОТРОШУВАЧКА ПРИ ГРЕЕЊЕ, KW 938","СЕЗОНСКИ СООДНОС НА ЕНЕРГЕТСКА ЕФИКАСНОСТ ПРИ ЛАДЕЊЕ SEER 6.19","СЕЗОНСКИ КОЕФИЦИЕНТ НА ПЕРФОРМАНСИ ВО ГРЕЕЊЕ SCOP 4.03","РАБОТНА ТЕМПЕРАТУРА, °C -20 °C до 46 °C","ЦИРКУЛАЦИЈА НА ВОЗДУХ, M?/H 600","БУЧАВА – ВНАТРЕШНА ЕДИНИЦА, DB(A) 53","БУЧАВА – НАДВОРЕШНА ЕДИНИЦА, DB(A) 62","ДИМЕНЗИИ НА ВНАТРЕШНА ЕДИНИЦА Ш X В X Д, MM 792 x 292 x 201","ДИМЕНЗИИ НА НАДВОРЕШНА ЕДИНИЦА Ш X В X Д, MM 705 x 530 x 279","TEЖИНА НА ВНАТРЕШНА ЕДИНИЦА, KG 8.5","ТЕЖИНА НА НАДВОРЕШНА ЕДИНИЦА, KG 22.5","ДОДАТНИ ФУНКЦИОНАЛНОСТИ","AutoCleaning","DeepSleep","Filter Anti 2.5 PM","5-step Cleaning","DryingMode","PlasmaSterilization","WiFi integrated","iFeel","Интелигентно одмрзнување","ГАРАНЦИЈА 36 месеци","","","","","","","","","","","","","","","","","","","","","","","","","","","","","","","","","","","","","","","","","","","","","","","","","","","","","","","","","","","","","","","","","","","","","","","","","","","","","","","","","","","","","",""
"RIVERSOFT","Klima HISENSE ENERGY SE KA35XR0EG/KA35XR0EW INVERTER 3.5KW -22C WI-FI","30990.00 ден.","https://digimak.s3.eu-west-1.amazonaws.com/riversoft/113435/1.webp","Тип на единицата: Внатрешна единица","Тип на монтажа: На ѕид","Далечинско управување: Далечински управувач","Препорачана употребна површина: 12-24","Работна температура во режим на греење : -22- 24","Опсег на работна температура во режим на ладење: -15 - 43","Опсег на поставување на температура: 16-30","Компактен дизајн","Копче за рачно управување","Режим на работа: Инвертер","Разладно средство: R32","Меморија на позицијата на насочувачите","Двоен одвод на кондензатот: Лево или десно","EER: 3,93","Енергетска класа - греење: A+++","Брзина на надворешниот вентилатор: 3","Брзина на внатрешниот вентилатор: 7","Моќност за ладење (BTU/h): 12000","Моќност за ладење (BTU/h): 12000","Далечински управувач како собен термостат","Скриен ЛЕД дисплеј","Затемнување на екран","Само-дијагностика","Автоматски внатрешен вентилатор","Просечна грејна моќност (Pdesignh) - просечна грејна сезона: 2,8 kW","Деклариран капацитет (Pdh(Tj)) - просечна грејна сезона: 2,8 kW","Моќност за ладење: 3,5 kW","Капацитет на одвлажнување: 1,2 L/h","Дијаметар на кондензациската цевка: 18 mm","4 во 1 филтер - витамин Ц, катехин, сребрени јони, ХЕПА, активен јаглен","Автоматско работење","Автоматско повторно вклучување (при прекин на електрична енергија)","Функција за самочистење","Заштита од замрзнување","Ноќен режим на работа - Night mode","Турбо функција","Ладење","Греење","Функција за отстранување на влага","Вентилирање - проветрување","Тајмер 24h","Паметна гласовна контрола","Hi-nano Генератор","Приклучна моќ(V): 220-240 V","Минимална јачина на звукот: 56 dB(A)re1pW","Грејна моќност: 3.900 W","Потрошувачка на електрична енергија во режим на мирување: 1 W","Фреквенција: 50 Hz","Разладна моќност: 3.500 W","Полнење на фреон: 0,8 gr","Минимален звучен притисок: 31 dB(A)2x10-5Pa","Максимален звучен притисок: 40 dB(A)2x10-5Pa","Потрошувачка на ел. енергија при греење: 1.000 W","Потрошувачка на ел. енергија при ладење: 890 W","Греач на надворешна единица","Минимален проток на воздух: 350 m?","Проток на воздухот: 580 m?","Цевка за течност: 6,35 mm","Дијаметар на цевката за разладен медиум: 9,53 mm","Максимална должина на цевките: 15 m","Максимална висинска разлика: 8 m","Номинална вредност на струјата при ладење: 4 A","Номинална вредност на струјата при греење: 4,5 A","Сооднос SEER - ладење: 8,5","Сооднос SCOP - греење: 4,6","Коефициент COP: 3,9","Минимален звучен притисок: 31 dB(A)2x10-5Pa","Максимален звучен притисок: 40 dB(A)2x10-5Pa","Wi-Fi управување: Вградено","Димензии (ШxВxД): 79,8 ? 25,6 ? 19,1 cm","Димензии на амбалажата (ШxВxД): 85 ? 32 ? 26 cm","Нето тежина на апаратот: 7,6 kg","Бруто тежина на апаратот: 8,88 kg","Потрошувачка на електрична енергија во режим на мирување: 1 W","Осигурувач: 5 A","Код: 20003818","","","","","","","","","","","","","","","","","","","","","","","","","","","","","","","","","","","","","","",""
"RIVERSOFT","Klima VIVAX ACP-12CH35AEHI+ R32 SILVER A+++ 12-ka Inverter","33999.00 ден.","https://digimak.s3.eu-west-1.amazonaws.com/riversoft/118778/1.webp","ЕНЕРГЕТСКА КЛАСА (SEER/SCOP):A+++ (8.5/4.6)","МАКСИМАЛЕН КАПАЦИТЕТ НА ЛАДЕЊЕ:4308.00 W","МАКСИМАЛЕН КАПАЦИТЕТ НА ГРЕЕЊЕ:4396.00 W","ПРОСЕЧНА МОЌНОСТ:3517/3810 W","ВЛЕЗНА МОЌНОСТ ЛАДЕЊЕ:900 W","ВЛЕЗНА МОЌНОСТ ГРЕЕЊЕ:950 W","ПРОТОК НА ВОЗДУХ:700.00 m3","КАПАЦИТЕТ НА ОДВЛАЖНУВАЊЕ:1.20 l/h","НИВО НА БУЧАВА:40.00 dB","РАБОТНА ТЕМПЕРАТУРА:ОД -25 ? ДО 50 ?","МАСА ВНАТРЕШНА ЕДИНИЦА:11.30 kg","МАСА НАДВОРЕШНА ЕДИНИЦА:26.40 kg","ПРЕПОРАЧАНА ПОВРШИНА:до 40 м2","ФРЕОН:R32","ФИЛТРИ:Филтер за прашина, био филтер","ДИМЕНЗИИ НАДВ. ЕДИНИЦА:765 X 303 X 555 mm","ГАРАНЦИЈА:5 години","","","","","","","","","","","","","","","","","","","","","","","","","","","","","","","","","","","","","","","","","","","","","","","","","","","","","","","","","","","","","","","","","","","","","","","","","","","","","","","","","","","","","","","","","","","","","","","","","",""
"RIVERSOFT","Klima VOX IJL18-SC4DWH Inverter","34900.00 ден.","https://digimak.s3.eu-west-1.amazonaws.com/riversoft/9991290/1.webp","ЕНЕРГЕТСКА КЛАСА A++/A+","BTU 18000","КАПАЦИТЕТ ЗА ЛАДЕЊЕ, KW 5,30","КАПАЦИТЕТ ЗА ГРЕЕЊЕ, KW 5,60","НОМИНАЛНА ПОТРОШУВАЧКА ПРИ ЛАДЕЊЕ, KW 1,58","НОМИНАЛНА ПОТРОШУВАЧКА ПРИ ГРЕЕЊЕ, KW 1,55","ГОДИШНА ПОТРОШУВАЧКА ПРИ ЛАДЕЊЕ, KW 265","ГОДИШНА ПОТРОШУВАЧКА ПРИ ГРЕЕЊЕ, KW 1470","СЕЗОНСКИ СООДНОС НА ЕНЕРГЕТСКА ЕФИКАСНОСТ ПРИ ЛАДЕЊЕ SEER 6,19","СЕЗОНСКИ КОЕФИЦИЕНТ НА ПЕРФОРМАНСИ ВО ГРЕЕЊЕ SCOP 4,19","РАБОТНА ТЕМПЕРАТУРА, °C -15°C to +49°C","ЦИРКУЛАЦИЈА НА ВОЗДУХ, M?/H 600","БУЧАВА – ВНАТРЕШНА ЕДИНИЦА, DB(A) 53","БУЧАВА – НАДВОРЕШНА ЕДИНИЦА, DB(A) 62","ДИМЕНЗИИ НА ВНАТРЕШНА ЕДИНИЦА Ш X В X Д, MM 940 x 316 x 224","ДИМЕНЗИИ НА НАДВОРЕШНА ЕДИНИЦА Ш X В X Д, MM 785 x 555 x 300","TEЖИНА НА ВНАТРЕШНА ЕДИНИЦА, KG 11,5","ТЕЖИНА НА НАДВОРЕШНА ЕДИНИЦА, KG 28","ДОПОЛНИТЕЛНИ ИНФОРМАЦИИ Wi-Fi integrated","4D Air Flow","Грејач на надворенашнта единица","AutoCleaning","DeepSleep","Брзо ладење и греење","DryingMode","Голем домет на климатизираниот воздух","Флексибилна инсталација","Интелигентно одмрзнување","Самочитење на надворешната единица","Inverter","Тајмер","Повеќекратна заштита","ГАРАНЦИЈА 60 месеци","ДОКУМЕНТИ Енергетска класа","Список со информации за производот","","","","","","","","","","","","","","","","","","","","","","","","","","","","","","","","","","","","","","","","","","","","","","","","","","","","","","","","","","","","","","","","","","","","","","","","","","","","","","","",""
"RIVERSOFT","Klima DIPLOMAT DAW-180 Smart Winter Inverter A++ Wi-Fi -25°C Greac Healty Filte","37999.00 ден.","https://digimak.s3.eu-west-1.amazonaws.com/riversoft/9993849/1.webp","Тип: Инвертор;","Контрола: Далечински;","Моќност во режим на ладење: 5100W;","Моќност во режим на греење: 5130W;","Wi-Fi контрола;","Автоматско рестартирање;","Паметен проток на воздух;","Лесен за чистење филтер;","Интелигентно одмрзнување;","Тајмер;","Греач на надворешна единица","Healthy филтер","Режим на спиење;","Самочистење;","SEER: 6.1;","Енергетска класа: A+++;","SCOP медиум: 4.0;","Отстранување на влага: 1,5L/час;","Опсег на надворешна температура (греење): -25-30°C;","Напон: 220-240V/50Hz;","Напојување: надворешен;","Потрошувачка на енергија во режим на ладење: 1574W;","Потрошувачка на енергија во режим на греење: 1382W;","Фреон: R32;","Димензии на внатрешната единица (WxHxD): 920x306x195mm;","Димензии на надворешниот уред (WxHxD): 853x602x349mm;","Нето тежина на внатрешната единица: 11кг;","Нето тежина на надворешната единица: 35кг;","Големина на пакетот на внатрешната единица: 990x380x265mm;","Големина на пакетот на надворешниот уред: 890x628x385mm;","Бруто тежина на внатрешната единица: 13кг;","Бруто тежина на надворешниот уред (без цевки): 38кг;","","","","","","","","","","","","","","","","","","","","","","","","","","","","","","","","","","","","","","","","","","","","","","","","","","","","","","","","","","","","","","","","","","","","","","","","","","","","","","","","","","",""
"RIVERSOFT","Klima HOOBART HBTC24INV-WMSE2 24-ka Inverter -25 A++/A+","36999.00 ден.","https://digimak.s3.eu-west-1.amazonaws.com/riversoft/47013263/1.webp","Инвертер клима уред","Капацитет ладење/греење: 7.1kW","Годишна потрошувачка на енергија за ладење:377kWh","Годишна потрошувачка на енергија за греење:1715kWh","Енергетска класа на ладење:А++","Енергетска класа на греење:А+","Циркулација на воздух: 1000m3/h","Ниво на бучава:58dB","Работна температура: ладење(-15 - 53)/греење(-25 - 30)","R32 еколошки фреон","","","","","","","","","","","","","","","","","","","","","","","","","","","","","","","","","","","","","","","","","","","","","","","","","","","","","","","","","","","","","","","","","","","","","","","","","","","","","","","","","","","","","","","","","","","","","","","","","","","","","","","","",""
"RIVERSOFT","Klima Samsung Luzon AR12TXHZAWKNEU/AR12TXHZAWKXEU inverter 3.5KW","38690.00 ден.","https://digimak.s3.eu-west-1.amazonaws.com/riversoft/116488/1.webp","Технички податоци","Капацитет на ладење (kW): 3,5 (0,9-4,0)","Капацитет на загревање (kW): 3,5 (0,9-5,0)","Ладилник: R32","Пристаниште ел. Енергија за ладење (W): 1220","Пристаниште ел. Енергетско греење (W): 940","SEER (W): 6,5","SCOP (W): 4.0","Напојување (ph-V-Hz): 1-220-240-50","Ниво на моќност на звукот u.j. (dB(A)): 56","Ниво на притисок на звукот u.j. (dB(A)): 38/19","Ниво на моќност на звукот v.j. (dB(A)): 64","Ниво на притисок на звукот v.j. (dB(A)): 47","Димензии на внатрешната единица - SxVxD (mm): 820x299x215","Димензии на надворешни единици - SxVxD (mm): 660x475x242","Тежина на внатрешната единица (kg): 9.1/11.1","Тежина на надворешната единица (кг): 22,6/24,3","Течна фаза со пречник на цевките (инч(мм)): 1/4 (фи 6.35)","Гасна фаза со дијаметар цевки (инч(мм)): 3/8(fi 9.52)","Макс должина на нафтоводот (m): 15","Макс висинска разлика (m): 8","Работна област hl./gr°C (Min~Max): .-10 ~ 46 / .-15 ~ 24","Расред на носачот на надворешни единици (cm): 43,6","Гаранција: 2 години","","","","","","","","","","","","","","","","","","","","","","","","","","","","","","","","","","","","","","","","","","","","","","","","","","","","","","","","","","","","","","","","","","","","","","","","","","","","","","","","","","","","","","","","","","",""
"RIVERSOFT","Klima Toyotomi ErAi Mystery White CTN/CTG-335W 12-ka Invertrer A+++/A+++ -25","39900.00 ден.","https://digimak.s3.eu-west-1.amazonaws.com/riversoft/9996475/1.webp","ЕНЕРГЕТСКА КЛАСА A+++ / A+++","BTU (ЛАДЕЊЕ / ГРЕЕЊЕ) 12000 / 13000","КАПАЦИТЕТ ЗА ЛАДЕЊЕ (MIN / NOM / MAX), KW 0,90 / 3,50 / 4,40","КАПАЦИТЕТ ЗА ГРЕЕЊЕ (MIN / NOM / MAX), KW 0,90 / 3,20 / 4,70","ГОДИШНА ПОТРОШУВАЧКА ПРИ ЛАДЕЊЕ, KW 144","ГОДИШНА ПОТРОШУВАЧКА ПРИ ГРЕЕЊЕ, KW 875","СЕЗОНСКИ СООДНОС НА ЕНЕРГЕТСКА ЕФИКАСНОСТ ПРИ ЛАДЕЊЕ SEER 8.5","СЕЗОНСКИ КОЕФИЦИЕНТ НА ПЕРФОРМАНСИ ВО ГРЕЕЊЕ SCOP 5.6","ПРЕПОРАЧАНА ПОВРШИНА, M? 25-35","РАБОТНА ТЕМПЕРАТУРА, °C -25 ~ +50","ЦИРКУЛАЦИЈА НА ВОЗДУХ, M?/H 390-680","БУЧАВА – ВНАТРЕШНА ЕДИНИЦА, DB(A) 19-43","БУЧАВА – НАДВОРЕШНА ЕДИНИЦА, DB(A) 53","ДИМЕНЗИИ НА ВНАТРЕШНА ЕДИНИЦА Ш X В X Д, MM 837 ? 293 ? 200","ДИМЕНЗИИ НА НАДВОРЕШНА ЕДИНИЦА Ш X В X Д, MM 802 ? 555 ? 330","TEЖИНА НА ВНАТРЕШНА ЕДИНИЦА, KG 9,5","ТЕЖИНА НА НАДВОРЕШНА ЕДИНИЦА, KG 25,5","ДОДАТОЦИ HEPA/Silver Ion/Biology sterilization","Вештачка интелигенција „AI”Wi-Fi","Plasma јоннизатор","UV стерилизаија на воздух","Грејач на надворешна единица","ГАРАНЦИЈА 24 месеци","","","","","","","","","","","","","","","","","","","","","","","","","","","","","","","","","","","","","","","","","","","","","","","","","","","","","","","","","","","","","","","","","","","","","","","","","","","","","","","","","","","","","","","","","","","",""
"RIVERSOFT","Klima Vivax COOL ACP-18CH50AEMIs R32 18ka inverter","39990.00 ден.","https://digimak.s3.eu-west-1.amazonaws.com/riversoft/20549/1.webp","МАКСИМАЛЕН КАПАЦИТЕТ НА ЛАДЕЊЕ: 6130.00 W","МАКСИМАЛЕН КАПАЦИТЕТ НА ГРЕЕЊЕ: 6740.00 W","ПРОСЕЧНА МОЌНОСТ: 5280/5570 W","ВЛЕЗНА МОЌНОСТ ЛАДЕЊЕ: 1539 W","ВЛЕЗНА МОЌНОСТ ГРЕЕЊЕ: 1480 W","ПРОТОК НА ВОЗДУХ: 840.00 m3","КАПАЦИТЕТ НА ОДВЛАЖНУВАЊЕ: 1.80 l/h","НИВО НА БУЧАВА: 44.00 dB","РАБОТНА ТЕМПЕРАТУРА: ОД -15 ? ДО 50 ?","МАСА ВНАТРЕШНА ЕДИНИЦА: 10.00 kg","МАСА НАДВОРЕШНА ЕДИНИЦА: 34.00 kg","ПРЕПОРАЧАНА ПОВРШИНА: 55 м2","ФРЕОН: R32","ФИЛТРИ: Био филтер, филтер за прашина","ДИМЕНЗИИ ВНАТ. ЕДИНИЦА: 957 X 302 X 213 mm","ДИМЕНЗИИ НАДВ. ЕДИНИЦА: 800 X 554 X 333 mm","ГАРАНЦИЈА: 3 години","Висока ефикасност, самодијагноза, 1W standby, заштита на вентил надворешна","единица, 12 Fan Speed, self cleaning, индикатор за истекување на гасот за","разладување, безшумна операција, двосмерен одвод на кондензат, дигитален екран,","sleep mode, тајмер, интелегентно отопување, memory функција, турбо, припрема за WiFi ( WiFi ready )","","","","","","","","","","","","","","","","","","","","","","","","","","","","","","","","","","","","","","","","","","","","","","","","","","","","","","","","","","","","","","","","","","","","","","","","","","","","","","","","","","","","","","","","","","","","","",""
"RIVERSOFT","Klima VIVAX COOL ACP-12CH35REWI R32 A+++ Inverter 12-ka","39990.00 ден.","https://digimak.s3.eu-west-1.amazonaws.com/riversoft/114245/1.webp","МАКСИМАЛЕН КАПАЦИТЕТ НА ГРЕЕЊЕ:5199.00 W","ПРОСЕЧНА МОЌНОСТ:3500/4200 W","ВЛЕЗНА МОЌНОСТ ЛАДЕЊЕ:875 W","ВЛЕЗНА МОЌНОСТ ГРЕЕЊЕ:1100 W","ПРОТОК НА ВОЗДУХ:650.00 m3","КАПАЦИТЕТ НА ОДВЛАЖНУВАЊЕ:1.60 l/h","НИВО НА БУЧАВА:38.00 dB","РАБОТНА ТЕМПЕРАТУРА:ОД -15 ? ДО 43 ?","МАСА ВНАТРЕШНА ЕДИНИЦА:10.00 kg","МАСА НАДВОРЕШНА ЕДИНИЦА:31.50 kg","ПРЕПОРАЧАНА ПОВРШИНА:до 40 м2","ФРЕОН:R32","ФИЛТРИ:Nano Aqua јонизатор,филтер за прашина и био филтер","ДИМЕНЗИИ НАДВ. ЕДИНИЦА:800 X 553 X 275 mm","ГАРАНЦИЈА:5 години","","","","","","","","","","","","","","","","","","","","","","","","","","","","","","","","","","","","","","","","","","","","","","","","","","","","","","","","","","","","","","","","","","","","","","","","","","","","","","","","","","","","","","","","","","","","","","","","","","","",""
"RIVERSOFT","Klima MDV MSAGCU-18HRFN8 AG Serie 5,5KW 18-ka Inverter -20 A++/A+","40999.00 ден.","https://digimak.s3.eu-west-1.amazonaws.com/riversoft/47013665/1.webp","Ладење капацитет: 5270 W","Греење капацитет: 5650 W","Енер. класа A++/A+","SEER/SCOP: 7.0/4.0","Работен капацитет(kW) :3.1 – 5.85","Работен опсег(C°): -20~50","Греач на надворешна единица","Комперсор","Тип: ROTARY","Бренд: GMCC","Внатрешна единица","Проток на воздух (m3/h): 800/600/500","Ниво на бучавост (dB): 41/37/31/20","Тежина (kg): 11.2","Димензија (mm): 969*320*241","Надворешна единица Димензија (mm): 874*330*554","Тежина (kg): 33,5","Цевки (mm): 6,35/12,17","Фреон: R32","","","","","","","","","","","","","","","","","","","","","","","","","","","","","","","","","","","","","","","","","","","","","","","","","","","","","","","","","","","","","","","","","","","","","","","","","","","","","","","","","","","","","","","","","","","","","","","",""
